{
  "$schema": "http://json-schema.org/draft-07/schema#",
  "title": "Ask::LLM Model Entry",
  "description": "A single model entry in the ask-llm-providers model catalog",
  "type": "object",
  "required": ["id", "provider"],
  "properties": {
    "id": {
      "type": "string",
      "description": "Model identifier used in API requests"
    },
    "name": {
      "type": "string",
      "description": "Human-readable model name"
    },
    "provider": {
      "type": "string",
      "description": "Provider slug matching a registered Ask::Provider (e.g. 'openai', 'opencode')"
    },
    "family": {
      "type": "string",
      "description": "Model family grouping (e.g. 'gpt4o', 'claude_sonnet')"
    },
    "context_window": {
      "type": "integer",
      "description": "Maximum context window in tokens"
    },
    "max_output_tokens": {
      "type": "integer",
      "description": "Maximum output tokens"
    },
    "capabilities": {
      "type": "array",
      "items": {
        "type": "string",
        "enum": [
          "function_calling", "streaming", "structured_output",
          "vision", "reasoning", "audio", "embedding",
          "prompt_caching", "tool_choice", "parallel_tool_calls"
        ]
      },
      "description": "Capability flags for this model"
    },
    "modalities": {
      "type": "object",
      "properties": {
        "input": {
          "type": "array",
          "items": { "type": "string", "enum": ["text", "image", "audio", "pdf", "video"] }
        },
        "output": {
          "type": "array",
          "items": { "type": "string", "enum": ["text", "image", "audio", "embeddings"] }
        }
      }
    },
    "pricing": {
      "type": "object",
      "description": "Pricing information per million tokens"
    },
    "knowledge_cutoff": {
      "type": "string",
      "description": "Knowledge cutoff date"
    },
    "created_at": {
      "type": "string",
      "description": "Model release/creation date"
    },
    "metadata": {
      "type": "object",
      "description": "Additional metadata (open_weights, source, etc.)"
    }
  }
}
