[
  {
    "id": "mistral-large-2501",
    "name": "Mistral Large",
    "family": "mistral",
    "context_window": 128000,
    "max_output_tokens": 4096,
    "capabilities": [
      "function_calling",
      "streaming",
      "structured_output"
    ],
    "modalities": {
      "input": [
        "text"
      ],
      "output": [
        "text"
      ]
    },
    "provider": "mistral"
  },
  {
    "id": "mistral-small-2501",
    "name": "Mistral Small",
    "family": "mistral",
    "context_window": 128000,
    "max_output_tokens": 4096,
    "capabilities": [
      "function_calling",
      "streaming",
      "structured_output"
    ],
    "modalities": {
      "input": [
        "text"
      ],
      "output": [
        "text"
      ]
    },
    "provider": "mistral"
  },
  {
    "id": "mistral-embed",
    "name": "Mistral Embed",
    "family": "mistral",
    "context_window": 8192,
    "capabilities": [
      "embedding"
    ],
    "modalities": {
      "input": [
        "text"
      ],
      "output": [
        "embeddings"
      ]
    },
    "provider": "mistral"
  }
]
