[
  {
    "id": "grok-4.20-0309-non-reasoning",
    "name": "Grok 4.20 (Non-Reasoning)",
    "provider": "xai",
    "family": "grok",
    "context_window": 1000000,
    "max_output_tokens": 30000,
    "capabilities": [
      "function_calling",
      "structured_output",
      "vision"
    ],
    "modalities": {
      "input": [
        "text",
        "image",
        "pdf"
      ],
      "output": [
        "text"
      ]
    },
    "pricing": {
      "text_tokens": {
        "standard": {
          "input_per_million": 1.25,
          "output_per_million": 2.5,
          "cache_read_input_per_million": 0.2
        }
      }
    },
    "created_at": "2026-03-09"
  },
  {
    "id": "grok-4.20-0309-reasoning",
    "name": "Grok 4.20 (Reasoning)",
    "provider": "xai",
    "family": "grok",
    "context_window": 1000000,
    "max_output_tokens": 30000,
    "capabilities": [
      "function_calling",
      "structured_output",
      "reasoning",
      "vision"
    ],
    "modalities": {
      "input": [
        "text",
        "image",
        "pdf"
      ],
      "output": [
        "text"
      ]
    },
    "pricing": {
      "text_tokens": {
        "standard": {
          "input_per_million": 1.25,
          "output_per_million": 2.5,
          "cache_read_input_per_million": 0.2
        }
      }
    },
    "created_at": "2026-03-09"
  },
  {
    "id": "grok-4.20-multi-agent-0309",
    "name": "Grok 4.20 Multi-Agent",
    "provider": "xai",
    "family": "grok",
    "context_window": 1000000,
    "max_output_tokens": 30000,
    "capabilities": [
      "structured_output",
      "reasoning",
      "vision"
    ],
    "modalities": {
      "input": [
        "text",
        "image",
        "pdf"
      ],
      "output": [
        "text"
      ]
    },
    "pricing": {
      "text_tokens": {
        "standard": {
          "input_per_million": 1.25,
          "output_per_million": 2.5,
          "cache_read_input_per_million": 0.2
        }
      }
    },
    "created_at": "2026-03-09"
  },
  {
    "id": "grok-4.3",
    "name": "Grok 4.3",
    "provider": "xai",
    "family": "grok",
    "context_window": 1000000,
    "max_output_tokens": 30000,
    "capabilities": [
      "function_calling",
      "structured_output",
      "reasoning",
      "vision"
    ],
    "modalities": {
      "input": [
        "text",
        "image",
        "pdf"
      ],
      "output": [
        "text"
      ]
    },
    "pricing": {
      "text_tokens": {
        "standard": {
          "input_per_million": 1.25,
          "output_per_million": 2.5,
          "cache_read_input_per_million": 0.2
        }
      }
    },
    "created_at": "2026-04-17"
  },
  {
    "id": "grok-4.5",
    "name": "Grok 4.5",
    "provider": "xai",
    "family": "grok",
    "context_window": 500000,
    "max_output_tokens": 500000,
    "capabilities": [
      "function_calling",
      "structured_output",
      "reasoning",
      "vision"
    ],
    "modalities": {
      "input": [
        "text",
        "image",
        "pdf"
      ],
      "output": [
        "text"
      ]
    },
    "pricing": {
      "text_tokens": {
        "standard": {
          "input_per_million": 2,
          "output_per_million": 6,
          "cache_read_input_per_million": 0.5
        }
      }
    },
    "created_at": "2026-07-08"
  },
  {
    "id": "grok-build-0.1",
    "name": "Grok Build 0.1",
    "provider": "xai",
    "family": "grok-build",
    "context_window": 256000,
    "max_output_tokens": 256000,
    "capabilities": [
      "function_calling",
      "structured_output",
      "reasoning",
      "vision"
    ],
    "modalities": {
      "input": [
        "text",
        "image",
        "pdf"
      ],
      "output": [
        "text"
      ]
    },
    "pricing": {
      "text_tokens": {
        "standard": {
          "input_per_million": 1,
          "output_per_million": 2,
          "cache_read_input_per_million": 0.2
        }
      }
    },
    "created_at": "2026-04-16"
  },
  {
    "id": "grok-imagine-image",
    "name": "Grok Imagine Image",
    "provider": "xai",
    "family": "grok",
    "context_window": 8000,
    "max_output_tokens": 0,
    "capabilities": [
      "vision"
    ],
    "modalities": {
      "input": [
        "text",
        "image",
        "pdf"
      ],
      "output": [
        "image"
      ]
    },
    "pricing": {},
    "created_at": "2026-01-28"
  },
  {
    "id": "grok-imagine-image-quality",
    "name": "Grok Imagine Image Quality",
    "provider": "xai",
    "family": "grok",
    "context_window": 8000,
    "max_output_tokens": 0,
    "capabilities": [
      "vision"
    ],
    "modalities": {
      "input": [
        "text",
        "image",
        "pdf"
      ],
      "output": [
        "image"
      ]
    },
    "pricing": {},
    "created_at": "2026-04-03"
  },
  {
    "id": "grok-imagine-video",
    "name": "Grok Imagine Video",
    "provider": "xai",
    "family": "grok",
    "context_window": 1024,
    "max_output_tokens": 0,
    "capabilities": [
      "vision"
    ],
    "modalities": {
      "input": [
        "text",
        "image",
        "video",
        "pdf"
      ],
      "output": [
        "video"
      ]
    },
    "pricing": {},
    "created_at": "2026-01-28"
  },
  {
    "id": "grok-4.20",
    "name": "xAI: Grok 4.20",
    "provider": "xai",
    "context_window": 2000000,
    "capabilities": [],
    "modalities": {
      "input": [
        "text"
      ],
      "output": [
        "text"
      ]
    },
    "pricing": {
      "text_tokens": {
        "standard": {
          "input_per_million": 1.25,
          "output_per_million": 2.5,
          "cache_read_input_per_million": 0.2
        }
      }
    },
    "architecture": "text+image+file->text",
    "source": "openrouter"
  },
  {
    "id": "grok-4.20-multi-agent",
    "name": "xAI: Grok 4.20 Multi-Agent",
    "provider": "xai",
    "context_window": 2000000,
    "capabilities": [],
    "modalities": {
      "input": [
        "text"
      ],
      "output": [
        "text"
      ]
    },
    "pricing": {
      "text_tokens": {
        "standard": {
          "input_per_million": 1.25,
          "output_per_million": 2.5,
          "cache_read_input_per_million": 0.2
        }
      }
    },
    "architecture": "text+image+file->text",
    "source": "openrouter"
  }
]
