[
  {
    "id": "kimi-k2.6",
    "name": "Kimi K2.6",
    "family": "kimi",
    "context_window": 128000,
    "max_output_tokens": 64000,
    "capabilities": [
      "function_calling",
      "streaming",
      "reasoning"
    ],
    "modalities": {
      "input": [
        "text"
      ],
      "output": [
        "text"
      ]
    },
    "provider": "opencode_go"
  },
  {
    "id": "kimi-k2.5",
    "name": "Kimi K2.5",
    "family": "kimi",
    "context_window": 128000,
    "max_output_tokens": 64000,
    "capabilities": [
      "function_calling",
      "streaming",
      "reasoning"
    ],
    "modalities": {
      "input": [
        "text"
      ],
      "output": [
        "text"
      ]
    },
    "provider": "opencode_go"
  },
  {
    "id": "qwen3.6-plus",
    "name": "Qwen 3.6 Plus",
    "family": "qwen",
    "context_window": 128000,
    "max_output_tokens": 64000,
    "capabilities": [
      "function_calling",
      "streaming",
      "reasoning"
    ],
    "modalities": {
      "input": [
        "text"
      ],
      "output": [
        "text"
      ]
    },
    "provider": "opencode_go"
  },
  {
    "id": "qwen3.5-plus",
    "name": "Qwen 3.5 Plus",
    "family": "qwen",
    "context_window": 128000,
    "max_output_tokens": 64000,
    "capabilities": [
      "function_calling",
      "streaming",
      "reasoning"
    ],
    "modalities": {
      "input": [
        "text"
      ],
      "output": [
        "text"
      ]
    },
    "provider": "opencode_go"
  },
  {
    "id": "glm-5",
    "name": "GLM-5",
    "family": "glm",
    "context_window": 128000,
    "max_output_tokens": 64000,
    "capabilities": [
      "function_calling",
      "streaming",
      "reasoning"
    ],
    "modalities": {
      "input": [
        "text"
      ],
      "output": [
        "text"
      ]
    },
    "provider": "opencode_go"
  },
  {
    "id": "mimo-v2.5",
    "name": "MIMO V2.5",
    "family": "mimo",
    "context_window": 128000,
    "max_output_tokens": 64000,
    "capabilities": [
      "function_calling",
      "streaming",
      "reasoning"
    ],
    "modalities": {
      "input": [
        "text"
      ],
      "output": [
        "text"
      ]
    },
    "provider": "opencode_go"
  },
  {
    "id": "minimax-m2.7",
    "name": "MiniMax M2.7",
    "family": "minimax",
    "context_window": 128000,
    "max_output_tokens": 64000,
    "capabilities": [
      "function_calling",
      "streaming",
      "reasoning"
    ],
    "modalities": {
      "input": [
        "text"
      ],
      "output": [
        "text"
      ]
    },
    "provider": "opencode_go"
  }
]
