[
  {
    "id": "gpt-4o",
    "name": "GPT-4o",
    "family": "gpt4o",
    "context_window": 128000,
    "max_output_tokens": 16384,
    "capabilities": [
      "function_calling",
      "streaming",
      "structured_output",
      "vision"
    ],
    "modalities": {
      "input": [
        "text",
        "image"
      ],
      "output": [
        "text"
      ]
    },
    "provider": "openrouter"
  },
  {
    "id": "claude-sonnet-4-6",
    "name": "Claude Sonnet 4.6",
    "family": "claude_sonnet",
    "context_window": 200000,
    "max_output_tokens": 8192,
    "capabilities": [
      "function_calling",
      "streaming",
      "vision",
      "reasoning"
    ],
    "modalities": {
      "input": [
        "text",
        "image"
      ],
      "output": [
        "text"
      ]
    },
    "provider": "openrouter"
  },
  {
    "id": "claude-opus-4-7",
    "name": "Claude Opus 4.7",
    "family": "claude_opus",
    "context_window": 200000,
    "max_output_tokens": 8192,
    "capabilities": [
      "function_calling",
      "streaming",
      "vision",
      "reasoning"
    ],
    "modalities": {
      "input": [
        "text",
        "image"
      ],
      "output": [
        "text"
      ]
    },
    "provider": "openrouter"
  },
  {
    "id": "gemini-3-flash",
    "name": "Gemini 3 Flash",
    "family": "gemini",
    "context_window": 1000000,
    "max_output_tokens": 8192,
    "capabilities": [
      "function_calling",
      "streaming",
      "vision",
      "reasoning"
    ],
    "modalities": {
      "input": [
        "text",
        "image"
      ],
      "output": [
        "text"
      ]
    },
    "provider": "openrouter"
  },
  {
    "id": "deepseek-v4-flash",
    "name": "DeepSeek V4 Flash",
    "family": "deepseek_v4",
    "context_window": 1000000,
    "max_output_tokens": 384000,
    "capabilities": [
      "function_calling",
      "streaming",
      "reasoning"
    ],
    "modalities": {
      "input": [
        "text"
      ],
      "output": [
        "text"
      ]
    },
    "provider": "openrouter"
  }
]
