[
  {
    "id": "mimo-v2.5-pro",
    "name": "MIMO V2.5 Pro",
    "family": "mimo",
    "context_window": 128000,
    "max_output_tokens": 64000,
    "capabilities": [
      "function_calling",
      "streaming"
    ],
    "modalities": {
      "input": [
        "text"
      ],
      "output": [
        "text"
      ]
    },
    "provider": "mimo"
  }
]
